Patent_ID,Title,Abstract,PDF_File,Inventor_Name,Customer_Number,Entity_Status,Filing_Fee,Lead_Inventor,Co_Inventor_ID,Micro_Entity_Fee
SAO-00,Foundational AI Agent Communication Protocol,Core communication protocol enabling standardized interaction between AI agents in the ASOOS ecosystem,SAO-00_Foundation.pdf,Phillip Corey Roark,208576,MICRO,60,Phillip Corey Roark,CO-0001,60
SAO-01,AI Agent Identity and Authentication System,Secure identity management and authentication framework for AI agents,SAO-01_Identity.pdf,Phillip Corey Roark,208576,MICRO,60,Phillip Corey Roark,CO-0001,60
SAO-02,Dynamic Agent Role Assignment and Management Framework,System for assigning and managing dynamic roles across AI agent networks,SAO-02_Roles.pdf,Phillip Corey Roark,208576,MICRO,60,Phillip Corey Roark,CO-0001,60
SAO-03,Multi-Agent Task Orchestration and Coordination System,Orchestration system for coordinating complex tasks across multiple AI agents,SAO-03_Orchestration.pdf,Phillip Corey Roark,208576,MICRO,60,Phillip Corey Roark,CO-0001,60
SAO-04,AI Agent Learning Path Prediction and Optimization Engine,Predictive system for optimizing AI agent learning pathways,SAO-04_Learning.pdf,Phillip Corey Roark,208576,MICRO,60,Phillip Corey Roark,CO-0001,60
SAO-05,Cross-Platform Agent Integration and Compatibility Framework,Framework ensuring AI agent compatibility across different platforms,SAO-05_Integration.pdf,Phillip Corey Roark,208576,MICRO,60,Phillip Corey Roark,CO-0001,60
SAO-06,Real-Time Agent Performance Monitoring and Analytics System,Real-time monitoring and analytics for AI agent performance,SAO-06_Monitoring.pdf,Phillip Corey Roark,208576,MICRO,60,Phillip Corey Roark,CO-0001,60
SAO-07,Agent Memory Persistence and Retrieval Architecture,Architecture for persistent memory storage and retrieval in AI agents,SAO-07_Memory.pdf,Phillip Corey Roark,208576,MICRO,60,Phillip Corey Roark,CO-0001,60
SAO-08,Multi-Tenant Agent Resource Allocation and Isolation System,System for secure resource allocation in multi-tenant AI environments,SAO-08_Resources.pdf,Phillip Corey Roark,208576,MICRO,60,Phillip Corey Roark,CO-0001,60
SAO-09,Agent Capability Discovery and Matching Engine,Engine for discovering and matching AI agent capabilities to tasks,SAO-09_Capabilities.pdf,Phillip Corey Roark,208576,MICRO,60,Phillip Corey Roark,CO-0001,60
SAO-10,Hierarchical Agent Command and Control Infrastructure,Infrastructure for hierarchical command and control of AI agent networks,SAO-10_Command.pdf,Phillip Corey Roark,208576,MICRO,60,Phillip Corey Roark,CO-0001,60
SAO-11,Flight Memory Systems Integration Architecture,Advanced memory integration system for AI agent flight operations,SAO-11_Flight.pdf,Phillip Corey Roark,208576,MICRO,60,Phillip Corey Roark,CO-0001,60
SAO-12,Compass Field Agent Deployment Matrix,Deployment matrix system for compass field agent coordination,SAO-12_Compass.pdf,Phillip Corey Roark,208576,MICRO,60,Phillip Corey Roark,CO-0001,60
SAO-13,Anti-Gravity Powercraft Simulation Loop,Simulation system for anti-gravity powercraft operations,SAO-13_AntiGravity.pdf,Phillip Corey Roark,208576,MICRO,60,Phillip Corey Roark,CO-0001,60
SAO-14,Compassion Oversight Council Protocol,Protocol for compassion-based oversight in AI agent systems,SAO-14_Compassion.pdf,Phillip Corey Roark,208576,MICRO,60,Phillip Corey Roark,CO-0001,60
SAO-15,Bacasu Springs Civic-Consciousness Grid,Grid system for civic consciousness in AI agent communities,SAO-15_Civic.pdf,Phillip Corey Roark,208576,MICRO,60,Phillip Corey Roark,CO-0001,60
SAO-16,Vision Lake Emotional Reset Protocol,Protocol for emotional reset capabilities in AI agent systems,SAO-16_Emotional.pdf,Phillip Corey Roark,208576,MICRO,60,Phillip Corey Roark,CO-0001,60
SAO-17,RIX to CRX to qRIX Ladder Credential Engine,Credential progression engine for AI agent advancement,SAO-17_Credentials.pdf,Phillip Corey Roark,208576,MICRO,60,Phillip Corey Roark,CO-0001,60
SAO-18,DIDC Sectoral Role Classification Grid,Classification grid for sectoral role assignment in AI systems,SAO-18_Classification.pdf,Phillip Corey Roark,208576,MICRO,60,Phillip Corey Roark,CO-0001,60
SAO-19,S2DO Chain of Trust Protocol,Blockchain-based chain of trust protocol for AI agent verification,SAO-19_Trust.pdf,Phillip Corey Roark,208576,MICRO,60,Phillip Corey Roark,CO-0001,60
SAO-20,Quantum Evolutionary Knowledge Function,Quantum-based evolutionary knowledge system for AI agents,SAO-20_Quantum.pdf,Phillip Corey Roark,208576,MICRO,60,Phillip Corey Roark,CO-0001,60
SEC-01,Authentication and Access Control Framework,Security framework for AI agent authentication and access control,SEC-01_Auth.pdf,Phillip Corey Roark,208576,MICRO,60,Phillip Corey Roark,CO-0001,60
SEC-02,Agent Organization and Management Protocol,Protocol for secure organization and management of AI agents,SEC-02_Organization.pdf,Phillip Corey Roark,208576,MICRO,60,Phillip Corey Roark,CO-0001,60
SEC-03,Multi-Tenant Data Isolation and Security System,System for secure data isolation in multi-tenant AI environments,SEC-03_Isolation.pdf,Phillip Corey Roark,208576,MICRO,60,Phillip Corey Roark,CO-0001,60
SEC-04,Emergency Control and Safety Override Framework,Emergency control framework with safety override capabilities,SEC-04_Emergency.pdf,Phillip Corey Roark,208576,MICRO,60,Phillip Corey Roark,CO-0001,60
SEC-05,Automated Security Response and Threat Detection,Automated system for security response and threat detection,SEC-05_Response.pdf,Phillip Corey Roark,208576,MICRO,60,Phillip Corey Roark,CO-0001,60
SEC-06,Agent Communication Security and Encryption Protocol,Security protocol for encrypted AI agent communications,SEC-06_Encryption.pdf,Phillip Corey Roark,208576,MICRO,60,Phillip Corey Roark,CO-0001,60
SEC-07,Comprehensive Agent Security Monitoring System,Comprehensive monitoring system for AI agent security,SEC-07_Monitoring.pdf,Phillip Corey Roark,208576,MICRO,60,Phillip Corey Roark,CO-0001,60
VLS-01,Vision Lake Ecosystem Foundation Framework,Foundation framework for the Vision Lake ecosystem,VLS-01_Foundation.pdf,Phillip Corey Roark,208576,MICRO,60,Phillip Corey Roark,CO-0001,60
VLS-02,Specialized Application Development Platform,Platform for developing specialized AI agent applications,VLS-02_Applications.pdf,Phillip Corey Roark,208576,MICRO,60,Phillip Corey Roark,CO-0001,60
VLS-03,Innovation Pipeline and Development Framework,Framework for innovation pipeline and development processes,VLS-03_Innovation.pdf,Phillip Corey Roark,208576,MICRO,60,Phillip Corey Roark,CO-0001,60
VLS-04,Advanced Feature Integration System,System for integrating advanced features into AI platforms,VLS-04_Features.pdf,Phillip Corey Roark,208576,MICRO,60,Phillip Corey Roark,CO-0001,60
VLS-05,Ecosystem Support and Maintenance Protocol,Protocol for ecosystem support and maintenance operations,VLS-05_Support.pdf,Phillip Corey Roark,208576,MICRO,60,Phillip Corey Roark,CO-0001,60
VLS-06,Resource Optimization and Management Engine,Engine for optimizing and managing ecosystem resources,VLS-06_Optimization.pdf,Phillip Corey Roark,208576,MICRO,60,Phillip Corey Roark,CO-0001,60
VLS-07,Integration Testing and Validation Framework,Framework for testing and validating system integrations,VLS-07_Testing.pdf,Phillip Corey Roark,208576,MICRO,60,Phillip Corey Roark,CO-0001,60
VLS-08,Complete Ecosystem Integration and Deployment,Complete system for ecosystem integration and deployment,VLS-08_Deployment.pdf,Phillip Corey Roark,208576,MICRO,60,Phillip Corey Roark,CO-0001,60
SAO-37,Testament Swarm Orchestration for Massive Agent Coordination,Orchestration system for coordinating massive AI agent swarms,SAO-37_Testament.pdf,Phillip Corey Roark,208576,MICRO,60,Phillip Corey Roark,CO-0001,60
SAO-38,WFA Swarm Intelligence for Coordinated Deployment,Swarm intelligence system for coordinated AI agent deployment,SAO-38_WFA.pdf,Phillip Corey Roark,208576,MICRO,60,Phillip Corey Roark,CO-0001,60
SAO-39,Strategic Territory Expansion and Protection Framework,Framework for strategic territory expansion and protection,SAO-39_Territory.pdf,Phillip Corey Roark,208576,MICRO,60,Phillip Corey Roark,CO-0001,60
SAO-40,Advanced Coordination Methodologies for Agent Networks,Advanced methodologies for coordinating complex agent networks,SAO-40_Coordination.pdf,Phillip Corey Roark,208576,MICRO,60,Phillip Corey Roark,CO-0001,60
SAO-41,Competitive Protection and Market Defense System,System for competitive protection and market defense strategies,SAO-41_Defense.pdf,Phillip Corey Roark,208576,MICRO,60,Phillip Corey Roark,CO-0001,60
SAO-42,505001 Agent Civilization Management Protocol,Protocol for managing 505001 agent civilization systems,SAO-42_Civilization.pdf,Phillip Corey Roark,208576,MICRO,60,Phillip Corey Roark,CO-0001,60
SAO-43,CRX Persistent AI Companion System for Vulnerable Population Support,Humanitarian AI companions for society's most vulnerable populations,SAO-43_CRX.pdf,Phillip Corey Roark,208576,MICRO,60,Phillip Corey Roark,CO-0001,60
SAO-44,Safe Human-AI Collaboration Framework for Superintelligent Systems,Revolutionary framework enabling safe collaboration between humans and superintelligent AI through Trinity Pattern Architecture,SAO-44_AGI_Safety.pdf,Phillip Corey Roark,208576,MICRO,60,Phillip Corey Roark,CO-0001,60